{
  "generated_at": "2026-05-20T04:34:04.530Z",
  "repos": [
    {
      "name": "AudiobookMaker",
      "github_url": "https://github.com/MikkoNumminen/AudiobookMaker",
      "skills": [
        {
          "name": "ai-codegen-smell-audit",
          "description": "Read-only audit for specific failure modes that recur in LLM-generated code — defensive guards on impossible cases, generic names in domain code, swallowed errors, single-use helpers, mirror tests, and so on. Each check has a concrete smell example and a concrete legitimate counter-example so the auditor (human + assistant) can tell signal from noise. Produces `docs/audits/ai-smell-<YYYY-MM-DD>.md` with severity-ranked findings. Use whenever the user says \"smell audit\", \"check for AI-codegen smells\", \"review this branch for LLM-style sludge\", \"audit the code for generated-code patterns\", or asks for a calibration pass before merging a large generated diff. NOT a witch hunt for \"AI-written code\" — every finding must be a specific testable pattern with a concrete example, not a vibe.",
          "redirect": false,
          "receipt": {
            "path": ".claude/agent-verdicts/SKILL-USAGE-LATEST.json",
            "source": "transcript-measurement",
            "tokens_per_use": 199437,
            "uses_per_year": 4,
            "annual_total": 797748,
            "measurement_window_days": 90,
            "invocations_in_window": 1,
            "total_tokens_in_window": 199437,
            "last_invoked": "2026-05-17T03:24:06.864Z",
            "prior_estimate": {
              "tokens_per_use": 5500,
              "uses_per_year": 8,
              "annual_total": 44000,
              "source": "readme.md",
              "path": "https://github.com/MikkoNumminen/AudiobookMaker/blob/master/README.md"
            }
          }
        },
        {
          "name": "audit",
          "description": "Run a multi-phase robustness audit of the current codebase. Phase 1 tries language-appropriate static-analysis tools, skipping cleanly if absent. Phase 2 spawns five parallel subagents across non-overlapping scopes — resource lifecycle, data integrity, concurrency, error paths, external boundaries — each returning findings with file:line citations and severity. Phase 3 aggregates into docs/audits/audit-YYYY-MM-DD.md with a severity tally (critical / high / medium / low) and a branch topology recommendation for the fix follow-up. Use whenever the user says \"audit this codebase\", \"find bugs\", \"robustness review\", \"review for races / leaks / error swallows\", \"check for hidden bugs\", \"comprehensive review\", \"shake out issues before release\", or asks for a defect list. Not for style / readability reviews — see the \"When NOT to invoke\" section below.",
          "redirect": false,
          "receipt": {
            "path": ".claude/agent-verdicts/SKILL-USAGE-LATEST.json",
            "source": "transcript-measurement",
            "tokens_per_use": 434907,
            "uses_per_year": 4,
            "annual_total": 1739628,
            "measurement_window_days": 90,
            "invocations_in_window": 1,
            "total_tokens_in_window": 434907,
            "last_invoked": "2026-05-19T15:20:19.354Z",
            "prior_estimate": {
              "tokens_per_use": 3500,
              "uses_per_year": 8,
              "annual_total": 28000,
              "source": "readme.md",
              "path": "https://github.com/MikkoNumminen/AudiobookMaker/blob/master/README.md"
            }
          }
        },
        {
          "name": "ci-failure-triage",
          "description": "When CI fails on a release tag or PR, walk the failure modes in the right order against a recipe library built from the project's fix(ci) commit history. Use whenever the user says \"CI is red\", \"the build failed\", \"tag failed CI\", \"release-build broke\", or any time gh run list shows a recent failure on master or a release tag.",
          "redirect": false,
          "receipt": {
            "path": "https://github.com/MikkoNumminen/AudiobookMaker/blob/master/README.md",
            "source": "readme.md",
            "tokens_per_use": 1000,
            "uses_per_year": 88,
            "annual_total": 88000
          }
        },
        {
          "name": "copyright-scan",
          "description": "Scan a git diff (staged by default, or a named revision range / file set) for accidental third-party copyright leaks before they land on origin. Use this skill whenever the user says \"scan the diff\", \"copyright check\", \"scan for leaks\", \"is this safe to push\", \"check this before I commit\", \"did I leak anything?\", or whenever you are about to create a commit or push in this repo. CLAUDE.md marks copyright leakage as a P0 — this skill turns the manual scan ritual into one pass. Produces a structured pass/fail report with file:line citations and, on fail, the exact remediation path (edit vs. un-stage vs. P0 scrub-from-origin).",
          "redirect": false,
          "receipt": {
            "path": ".claude/agent-verdicts/SKILL-USAGE-LATEST.json",
            "source": "transcript-measurement",
            "tokens_per_use": 13881,
            "uses_per_year": 4,
            "annual_total": 55524,
            "measurement_window_days": 90,
            "invocations_in_window": 1,
            "total_tokens_in_window": 13881,
            "last_invoked": "2026-05-12T03:01:51.715Z",
            "prior_estimate": {
              "tokens_per_use": 3000,
              "uses_per_year": 0,
              "annual_total": 0,
              "source": "readme.md",
              "path": "https://github.com/MikkoNumminen/AudiobookMaker/blob/master/README.md"
            }
          }
        },
        {
          "name": "pronunciation-corpus-add",
          "description": "Append a Finnish pronunciation failure (a word the Chatterbox Grandmom voice mispronounces) to the project's pronunciation corpus at docs/pronunciation_corpus_fi.md. Use this whenever the user or a tester (Turo is the canonical one) reports that Grandmom said a Finnish word wrong — e.g. \"Grandmom pronounces X as Y\", \"add this to the corpus\", \"log this pronunciation bug\", \"the TTS messed up <word>\". Also use when the user pastes a transcript of what was heard vs. what was written. This corpus is the evidence base for targeted Pass I / lexicon fixes; entries must be structured so patterns across reports are visible at a glance.",
          "redirect": false,
          "receipt": {
            "path": "https://github.com/MikkoNumminen/AudiobookMaker/blob/master/README.md",
            "source": "readme.md",
            "tokens_per_use": 0,
            "uses_per_year": null,
            "annual_total": null
          }
        },
        {
          "name": "release-bundle-audit",
          "description": "Audit the AudiobookMaker PyInstaller release bundle for unused dependencies, dead-code data files, and accidental ML-stack pollution; then propose spec-only fixes on a `chore/release-bundle-size` branch. Use whenever the user says \"the installer is huge\", \"why is the bundle so big\", \"shake out unused deps before release\", \"shrink the .exe\", \"audit the .spec\", or asks why a frozen build ships some specific package. Encodes the empirical finding that ~28% of the v3.11.x bundle was dead-code data files (ffplay.exe, AVIF support, Arabic phonemizer, ONNX training tools) plus a defense-in-depth exclude set that prevents future regressions when a contributor accidentally pip-installs torch on the build machine.",
          "redirect": false,
          "receipt": {
            "path": "https://github.com/MikkoNumminen/AudiobookMaker/blob/master/README.md",
            "source": "readme.md",
            "tokens_per_use": 3500,
            "uses_per_year": 4,
            "annual_total": 14000
          }
        },
        {
          "name": "release-cut",
          "description": "Cut a new AudiobookMaker release (bump APP_VERSION, tag vX.Y.Z, push, verify CI lands SHA-256 in release notes AND sidecar). Use this skill whenever the user says \"cut a release\", \"bump the version\", \"ship X.Y.Z\", \"make a release\", \"release X.Y.Z\", or asks to tag a new version. Auto-update is existential for this project — a release that ships without a valid SHA-256 locks every existing user out of one-click updates. This skill encodes every moving part so that can never happen again.",
          "redirect": false,
          "receipt": {
            "path": ".claude/agent-verdicts/SKILL-USAGE-LATEST.json",
            "source": "transcript-measurement",
            "tokens_per_use": 188263,
            "uses_per_year": 4,
            "annual_total": 753052,
            "measurement_window_days": 90,
            "invocations_in_window": 1,
            "total_tokens_in_window": 188263,
            "last_invoked": "2026-05-12T02:05:50.511Z",
            "prior_estimate": {
              "tokens_per_use": null,
              "uses_per_year": 80,
              "annual_total": null,
              "source": "readme.md",
              "path": "https://github.com/MikkoNumminen/AudiobookMaker/blob/master/README.md"
            }
          }
        },
        {
          "name": "voice-pack-finnish",